init_query	rep_query	sys_num	sys_name
упрощенная система налогообложения	упрощенная система налогообложения 	 1 	 Система Бухгалтер
расторжение договора не прекращает	Вопрос: расторжение договора не прекращает 	 3 	 Система Юрист
необычные доказательства	Вопрос: необычные доказательства 	 3 	 Система Юрист
пристав может привлечь директора к уголовной ответтсвенности	Пристав может привлечь директора к уголовной ответственности 	 3 	 Система Юрист
солидарная или субсидиарная ответственность	Система Юрист 	 3 	 Система Юрист
что попадает под акцизу котельное топливо	Вопрос: что попадает под акцизу котельное топливо 	 1 	 Система Бухгалтер
дивиденды по привилегированным акциям определенных типов также могут выплачиваться за счет ранее сформированных для этих целей специальных фондов общества.	Дивиденды по привилегированным акциям определенных типов также могут выплачиваться за счет ранее сформированных для этих целей специальных фондов общества. 	 4 	 Система Финансист
университет	Вопрос: университет 	 7 	 Система Образование
исполнительный лист срок действия	исполнительный лист срок действия 	 3 	 Система Юрист
коап рф	КоАП РФ 	 3 	 Система Юрист
п. 1 ст. 784 п. 2 ст 785	Вопрос: п. 1 ст. 784 п. 2 ст 785 	 3 	 Система Юрист
оплата коммунальных услуг в аварийном доме	оплата коммунальных услуг в аварийном доме 	 10 	 Система Управление многоквартирным домом
как рассчитываются отпускные если уволился и устроился в одну и ту же организацию?	как рассчитываются отпускные если уволился и устроился в одну и ту же организацию? 	 2 	 Система Кадры
как считать плату за электроэнергию если поломался общедомовой прибор учета	как считать плату за электроэнергию если поломался общедомовой прибор учета 	 10 	 Система Управление многоквартирным домом
топ документов которые должен иметь предприниматель	Вопрос: топ документов которые должен иметь предприниматель 	 3 	 Система Юрист
налог на выбросы окружающей среды сроки уплаты	налог на выбросы окружающей среды сроки уплаты 	 13 	 Система Экология
акт сверки задолженности за пределами срока исковой давности	Акт сверки задолженности за пределами срока исковой давности 	 3 	 Система Юрист
запрос уставных документов у контрагента	Запрос уставных документов у контрагента 	 3 	 Система Юрист
примерная форма положения о конфликте интересов	примерная форма положения о конфликте интересов 	 3 	 Система Юрист
безбилетный пассажир	Вопрос: безбилетный пассажир 	 3 	 Система Юрист
нужно ли сотрудникам компании в случае их организации мероприятия в виде олимпиады на территории учебного заведения проходить медосмотр и оформлять медицинские книжки?	нужно ли сотрудникам компании в случае их организации мероприятия в виде олимпиады на территории учебного заведения проходить медосмотр и оформлять медицинские книжки? 	 8 	 Система Медицина
образец оферты	Вопрос: образец оферты 	 3 	 Система Юрист
12-489/2018	Вопрос: 12-489/2018 	 3 	 Система Юрист
согласие обладателя на передачу информации третьим лицам	Согласие обладателя на передачу информации третьим лицам 	 3 	 Система Юрист
приказ министерства транспорта № 128 от 16.04.2024	Вопрос: приказ министерства транспорта № 128 от 16.04.2024 	 3 	 Система Юрист
договор залога движимого имущества	договор залога движимого имущества 	 3 	 Система Юрист
отчет 1-пи	отчет 1-пи 	 1 	 Система Бухгалтер
как направить уведомление	как направить уведомление 	 3 	 Система Юрист
арендатор отозвал уведомление о расторжении остается ли право на отказ	Арендатор отозвал уведомление о расторжении остается ли право на отказ 	 3 	 Система Юрист
ходатайство о принятии меры по обеспечению исполнения исполнительного документа	ходатайство о принятии меры по обеспечению исполнения исполнительного документа 	 3 	 Система Юрист
гражданский кодекс 456	гражданский кодекс 456 	 3 	 Система Юрист
постановление четвертого арбитражного апелляционного суда от 15.12.2022 № 04ап-5830/2022, а19-14992/2022	постановление четвертого арбитражного апелляционного суда от 15.12.2022 № 04ап-5830/2022, а19-14992/2022 	 3 	 Система Юрист
порядок общения с ребенком	Вопрос: порядок общения с ребенком 	 7 	 Система Образование
договор на размещение рекламы с блогером	договор на размещение рекламы с блогером 	 3 	 Система Юрист
акт передачи комнаты в гостинице	акт передачи комнаты в гостинице 	 11 	 Система Генеральный директор
постановление правительства от 23.12.2024 № 1875	постановление правительства от 23.12.2024 № 1875 	 5 	 Система Госзаказ
договор простого товарищества	договор простого товарищества 	 3 	 Система Юрист
прицеп и полуприцеп	Вопрос: прицеп и полуприцеп 	 10 	 Система Управление многоквартирным домом
икры и шампанского столичному юристу	икры и шампанского столичному юристу 	 3 	 Система Юрист
трудовой кодекс особые условия	Вопрос: трудовой кодекс особые условия 	 2 	 Система Кадры
правила противопожарного режима в рф	правила противопожарного режима в рф 	 6 	 Система Охрана труда
согласие на обработку персональных данных при социальном опросе	Согласие на обработку персональных данных при социальном опросе 	 3 	 Система Юрист
присуждение компенсации бывшему мужу за его долю в доме	Присуждение компенсации бывшему мужу за его долю в доме 	 3 	 Система Юрист
об утверждении правил благоустройства территории муниципального образования город-курорт анапа	Вопрос: об утверждении правил благоустройства территории муниципального образования город-курорт анапа 	 10 	 Система Управление многоквартирным домом
ходатайство о проведении строительно-технической экспертизы	ходатайство о проведении строительно-технической экспертизы 	 14 	 Система Промбезопасность
исковое заявление к продавцу жилого дома	Вопрос: исковое заявление к продавцу жилого дома 	 3 	 Система Юрист
сим	Вопрос: сим 	 1 	 Система Бухгалтер
федеральный закон № 87-фз от 30 июня 2003	Вопрос: федеральный закон № 87-фз от 30 июня 2003 	 5 	 Система Госзаказ
отказ в смене ври	Вопрос: отказ в смене ври 	 2 	 Система Кадры
когда налоговая подаст на банкротство	Когда налоговая подаст на банкротство 	 3 	 Система Юрист
гост 5686-2020	Вопрос: гост 5686-2020 	 6 	 Система Охрана труда
ответственность за нарушение срока поставки	ответственность за нарушение срока поставки 	 3 	 Система Юрист
должностная инструкция начальника котельной	Вопрос: должностная инструкция начальника котельной 	 14 	 Система Промбезопасность
положение от 19 сентября 2014 № 431-п о правилах обязательного страхования гражданской ответственности владельцев транспортных	Вопрос: положение от 19 сентября 2014 № 431-п о правилах обязательного страхования гражданской ответственности владельцев транспортных 	 3 	 Система Юрист
одно заявление на отпуск без сохранения по основному месту и по внутреннему совместительству	Одно заявление на отпуск без сохранения по основному месту и по внутреннему совместительству 	 2 	 Система Кадры
обязаны ли усн выписывать счет-фактуру без ндс	обязаны ли усн выписывать счет-фактуру без ндс 	 1 	 Система Бухгалтер
9-367/2015	Вопрос: 9-367/2015 	 3 	 Система Юрист
620 гк рф	620 гк рф 	 3 	 Система Юрист
можно ли лицо привлечь к субсидиарной ответственности не в рамках банкротства	можно ли лицо привлечь к субсидиарной ответственности не в рамках банкротства 	 3 	 Система Юрист
п. 1 ст. 450 гк рф	п. 1 ст. 450 гк рф 	 3 	 Система Юрист
ответственность генерального директора в таблице	Вопрос: ответственность генерального директора в таблице 	 11 	 Система Генеральный директор
исчисление ндс в 2025 году по длящимся договорам	исчисление ндс в 2025 году по длящимся договорам 	 1 	 Система Бухгалтер
ходатайство о снижении неустойки	ходатайство о снижении неустойки 	 3 	 Система Юрист
гарантийный ремонт на основании экспертизы	гарантийный ремонт на основании экспертизы 	 3 	 Система Юрист
14-22 хмао-югра от 26.09.2023	Вопрос: 14-22 хмао-югра от 26.09.2023 	 6 	 Система Охрана труда
статья 30 уголовного кодекса	Вопрос: статья 30 уголовного кодекса 	 3 	 Система Юрист
ювенальная юстиция	Вопрос: ювенальная юстиция 	 3 	 Система Юрист
правила дорожного движения	Вопрос: правила дорожного движения 	 9 	 Система Культура
права потребителя	Вопрос: права потребителя 	 3 	 Система Юрист
после проведения спецоценки какой срок уведомить работников	После проведения спецоценки какой срок уведомить работников 	 6 	 Система Охрана труда
смена генерального директора ооо	Смена генерального директора ооо 	 11 	 Система Генеральный директор
заполнить м-15	Запрос: заполнить м-15 	 Номер системы: 15 	 Название системы: Госфинансы
возражение на расчет индексации присужденных судом сумм	возражение на расчет индексации присужденных судом сумм 	 3 	 Система Юрист
закон об ооо	Вопрос: закон об ооо 	 3 	 Система Юрист
жалоба на предписание	жалоба на предписание 	 3 	 Система Юрист
правовые обычаи	Вопрос: правовые обычаи 	 3 	 Система Юрист
порядок возмещения госпошлины истцом в случае вынесения определения в апелляционной инстанции в пользу ответчика заявителя жалобы	Вопрос: порядок возмещения госпошлины истцом в случае вынесения определения в апелляционной инстанции в пользу ответчика заявителя жалобы 	 3 	 Система Юрист
закон московской области № 199/2022-оз о запрете на территории московской области розничной продажи несовершеннолетним товаров, содержащих сжиженный углеводородный газ, для личных и бытовых нужд	Закон московской области № 199/2022-оз о запрете на территории московской области розничной продажи несовершеннолетним товаров, содержащих сжиженный углеводородный газ, для личных и бытовых нужд 	 3 	 Система Юрист
мчд для банка россии	мчд для банка россии 	 4 	 Система Финансист
подключение многоквартирного дома к городским системам водоснабжения	подключение многоквартирного дома к городским системам водоснабжения 	 10 	 Система Управление многоквартирным домом
гражданская ответственность генерального директора	гражданская ответственность генерального директора 	 3 	 Система Юрист
как признать законным собрание кредиторов в банкротстве	как признать законным собрание кредиторов в банкротстве 	 3 	 Система Юрист
пятиуровневая система документов	Вопрос: пятиуровневая система документов 	 1 	 Система Бухгалтер
нотариальное удостоверение решения осу о назначении еио при создании ооо	Вопрос: нотариальное удостоверение решения осу о назначении еио при создании ооо 	 3 	 Система Юрист
потребитель	Вопрос: потребитель 	 11 	 Система Генеральный директор
форма годового отчета ао	Вопрос: форма годового отчета ао 	 1 	 Система Бухгалтер
срок оплаты товара привязан к нескольким событиям	Вопрос: срок оплаты товара привязан к нескольким событиям 	 12 	 Система Продажи
доверенность на представительство на общем собрании акционеров	доверенность на представительство на общем собрании акционеров 	 3 	 Система Юрист
может ли арендатор по усн с 1 января 2025 года пересмотреть стоимость аренды, увеличить ее на сумму ндс?	может ли арендатор по усн с 1 января 2025 года пересмотреть стоимость аренды, увеличить ее на сумму ндс? 	 3 	 Система Юрист
вступление в силу решения суда если подана и отозвана апелляционная жалоба	Вопрос: вступление в силу решения суда если подана и отозвана апелляционная жалоба 	 3 	 Система Юрист
протокола ао об изменении оквэд	протокола ао об изменении оквэд 	 3 	 Система Юрист
транспортная компания привезла побитое оборудование и покупатель отказался его принимать	Вопрос: транспортная компания привезла побитое оборудование и покупатель отказался его принимать 	 3 	 Система Юрист
охранник дворник	Вопрос: охранник дворник 	 6 	 Система Охрана труда
ретро оговорка	Вопрос: ретро оговорка 	 3 	 Система Юрист
недействительное условие о переходе риска гибели предмета лизинга	недействительное условие о переходе риска гибели предмета лизинга 	 3 	 Система Юрист
314 гк рф	Вопрос: 314 гк рф 	 3 	 Система Юрист
ходатайство об увеличении исковых требований	ходатайство об увеличении исковых требований 	 3 	 Система Юрист
расходы на транспортные услуги	Расходы на транспортные услуги 	 1 	 Система Бухгалтер
закрытие суммы аванса по договору подряда	закрытие суммы аванса по договору подряда 	 3 	 Система Юрист
как проводить собеседование	как проводить собеседование 	 2 	 Система Кадры
контракт на поставку товара по 44-фз для сельских поселений	контракт на поставку товара по 44-фз для сельских поселений 	 5 	 Система Госзаказ
ст. 149 гнк рф	ст. 149 гнк рф 	 1 	 Система Бухгалтер
прекращение регистрации автомобиля из-за аннулирования эптс	Вопрос: прекращение регистрации автомобиля из-за аннулирования эптс 	 3 	 Система Юрист
должностная инструкция ведущего юрисконсульта	Вопрос: должностная инструкция ведущего юрисконсульта 	 3 	 Система Юрист
закон об лицензировании производства лекарст	закон об лицензировании производства лекарств 	 8 	 Система Медицина
валидация и верификация парниковых газов	Вопрос: валидация и верификация парниковых газов 	 13 	 Система Экология
обслуживание потребителей	Обслуживание потребителей 	 12 	 Система Продажи
независимая гарантия для мсп	Вопрос: независимая гарантия для мсп 	 3 	 Система Юрист
чем отличается регистрация программы для эвм в фипс от включения в реестр российского по	Вопрос: чем отличается регистрация программы для эвм в фипс от включения в реестр российского 	 3 	 Система Юрист
грузовой прицеп	Вопрос: грузовой прицеп 	 10 	 Система Управление многоквартирным домом
договор на полную материальную ответственность	договор на полную материальную ответственность 	 3 	 Система Юрист
договор на проектирование существенные условия	договор на проектирование существенные условия 	 3 	 Система Юрист
уведомление о расторжении договора	уведомление о расторжении договора 	 3 	 Система Юрист
прекращение исполнительного производства по заявлению должника	прекращение исполнительного производства по заявлению должника 	 3 	 Система Юрист
цифровой рубль	Вопрос: цифровой рубль 	 11 	 Система Генеральный директор
мое обучение	Вопрос: мое обучение 	 7 	 Система Образование
лишение директора премии	лишение директора премии 	 3 	 Система Юрист
а65-20907/2023	Вопрос: а65-20907/2023 	 3 	 Система Юрист
гост 31937-2011	гост 31937-2011 	 6 	 Система Охрана труда
договор мены	договор мены 	 3 	 Система Юрист
отвечает ли поставщик за недостатки товара, если покупатель самостоятельно пытался устранить эти недостатки	Вопрос: отвечает ли поставщик за недостатки товара, если покупатель самостоятельно пытался устранить эти недостатки 	 3 	 Система Юрист
постановление от 29.06.2021 № 1051	постановление от 29.06.2021 № 1051 	 3 	 Система Юрист
журнал движения трудовых книжек	Журнал движения трудовых книжек 	 2 	 Система Кадры
