init_query	rep_query	sys_num	sys_name
запрос в налоговую о движении денежных средств по счету	Запрос в налоговую о движении денежных средств по счету 	 1 	 Система Бухгалтер
частная жалоба на определение об отказе в передаче дела	Частная жалоба на определение об отказе в передаче дела 	 3 	 Система Юрист
частная жалоба на определение районного суда о передаче дела по подсудности	Частная жалоба на определение районного суда о передаче дела по подсудности 	 3 	 Система Юрист
одм 218.4.001-2008	Вопрос: одм 218.4.001-2008 	 6 	 Система Охрана труда
сдача отчетности в сфр по гражданско-правовым вопросам	сдача отчетности в сфр по гражданско-правовым вопросам 	 3 	 Система Юрист
какие сведенья публикуют юрлицу в ефрсфдюл	какие сведенья публикуют юрлицу в ефрсфдюл 	 3 	 Система Юрист
договор на рекламные услуги	договор на рекламные услуги 	 11 	 Система Генеральный директор
постановлением правительства от 23.12.2024 № 1875 о мерах по предоставлению национального режима при осуществлении закупок товаров, работ, услуг для обеспечения государственных и муниципальных нужд,	постановлением правительства от 23.12.2024 № 1875 о мерах по предоставлению национального режима при осуществлении закупок товаров, работ, услуг для обеспечения государственных и муниципальных нужд 	 5 	 Система Госзаказ
предварительный договор для еис	Предварительный договор для ЕИС 	 5 	 Система Госзаказ
международное налогообложение	Вопрос: международное налогообложение 	 1 	 Система Бухгалтер
как заставить таблиц	Вопрос: как заставить таблиц 	 4 	 Система Финансист
финансовая грамотность	финансовая грамотность 	 4 	 Система Финансист
работы по гоз 223	работы по гоз 223 	 5 	 Система Госзаказ
правила проезда пассажиров в пригородных поездах	Вопрос: правила проезда пассажиров в пригородных поездах 	 1 	 Система Бухгалтер
нарушение интеллектуальных прав размер компенсации	Вопрос: нарушение интеллектуальных прав размер компенсации 	 3 	 Система Юрист
115-фз	Вопрос: 115-фз 	 5 	 Система Госзаказ
оплата с абс на рс	оплата с абс на рс 	 1 	 Система Бухгалтер
уведомление о расторжении договора образец	уведомление о расторжении договора образец 	 3 	 Система Юрист
полномочия работодателя	полномочия работодателя 	 2 	 Система Кадры
банкротство физического лица через суд	банкротство физического лица через суд 	 3 	 Система Юрист
какие меры можно принять к должнику судебным приставом	какие меры можно принять к должнику судебным приставом 	 3 	 Система Юрист
незамедлительно это	Вопрос: незамедлительно это 	 8 	 Система Медицина
гост 31937-2011.	Вопрос: гост 31937-2011 	 6 	 Система Охрана труда
залог исключительных прав на товарные знаки	Вопрос: залог исключительных прав на товарные знаки 	 3 	 Система Юрист
как на совете директоров утвердить перечень должностей	как на совете директоров утвердить перечень должностей 	 2 	 Система Кадры
предоставить донору два дня подряд по инициативе работодателя	Вопрос: предоставить донору два дня подряд по инициативе работодателя 	 2 	 Система Кадры
утрата на освобождения от ндс	Вопрос: утрата на освобождения от ндс 	 1 	 Система Бухгалтер
претензия за неправомерное использование фото	претензия за неправомерное использование фото 	 3 	 Система Юрист
присоединение общества с ограниченной	присоединение общества с ограниченной 	 3 	 Система Юрист
постановление 35-8	Вопрос: постановление 35-8 	 3 	 Система Юрист
периоды оплаты налога на прибыль	периоды оплаты налога на прибыль 	 1 	 Система Бухгалтер
размещение фотографий на сайте	Вопрос: размещение фотографий на сайте 	 11 	 Система Генеральный директор
мораторий пени в связи с коронавирусом	мораторий пени в связи с коронавирусом 	 1 	 Система Бухгалтер
продажа здания	продажа здания 	 14 	 Система Промбезопасность
взыскание предплаты за товар с поставщика украины при военном положении	взыскание предплаты за товар с поставщика украины при военном положении 	 3 	 Система Юрист
343-фз от 1е4.06.2022	Вопрос: 343-фз от 1е4.06.2022 	 5 	 Система Госзаказ
33-фз	Вопрос: 33-фз 	 5 	 Система Госзаказ
дом на сваях не нужно регистрировать	Вопрос: дом на сваях не нужно регистрировать 	 10 	 Система Управление многоквартирным домом
о защите личных неимущественных прав авторов произведений науки постановления № 474	Вопрос: о защите личных неимущественных прав авторов произведений науки постановления № 474 	 3 	 Система Юрист
постановление правительства 719 от 17 июля 2015	постановление правительства 719 от 17 июля 2015 	 5 	 Система Госзаказ
кадровый резерв	Кадровый резерв 	 2 	 Система Кадры
будет доступно после прохождения предыдущих тестов и повторения пройденного реклама и маркетинговые материалы: что проверить, что	Вопрос: будет доступно после прохождения предыдущих тестов и повторения пройденного реклама и маркетинговые материалы: что проверить, что 	 11 	 Система Генеральный директор
перенос пожарных гидрантов в подвале мкд	перенос пожарных гидрантов в подвале мкд 	 10 	 Система Управление многоквартирным домом
федерального закона от 24 июля 2007 года № 209-фз	Вопрос: федерального закона от 24 июля 2007 года № 209-фз 	 3 	 Система Юрист
виды работ по строительству капитальному и текущему ремонту	Вопрос: виды работ по строительству капитальному и текущему ремонту 	 14 	 Система Промбезопасность
возражения на заявление неверный расчет неустойки	возражения на заявление неверный расчет неустойки 	 3 	 Система Юрист
крупная сделка ано	Вопрос: крупная сделка ано 	 3 	 Система Юрист
33-231/2017	Вопрос: 33-231/2017 	 3 	 Система Юрист
установление контролирующих программ на рабочий компьютер работодателем	Система Охрана труда 	 6 	 Система Охрана труда
на момент подписания акта договор не был заключен	Вопрос: на момент подписания акта договор не был заключен 	 3 	 Система Юрист
договор аренды помещения гк рф	договор аренды помещения гк рф 	 3 	 Система Юрист
инн 7727295462	инн 7727295462 	 1 	 Система Бухгалтер
обособленное подразделение гк	обособленное подразделение гк 	 3 	 Система Юрист
исо 1042	Вопрос: исо 1042 	 14 	 Система Промбезопасность
самозанятый госслужащий	Вопрос: самозанятый госслужащий 	 15 	 Система Госфинансы
фз об обороте лекарственных	Вопрос: фз об обороте лекарственных 	 8 	 Система Медицина
договоров аренды на разные случаи	договоров аренды на разные случаи 	 3 	 Система Юрист
справка о процентном соотношении активов общества к стоимости продаваемых активов	Система Генеральный директор 	 11 	 Система Генеральный директор
обзор практики применения арбитражными судами положений процессуального законодательства об обязательном досудебном порядке урегулирования спора, утвержденного президиумом верховного суда рф 22 июля	Вопрос: обзор практики применения арбитражными судами положений процессуального законодательства об обязательном досудебном порядке урегулирования спора, утвержденного президиумом верховного суда рф 22 июля 	 3 	 Система Юрист
возмещение ущерба работодателю	возмещение ущерба работодателю 	 3 	 Система Юрист
договор на изготовление зубных протезов	договор на изготовление зубных протезов 	 3 	 Система Юрист
требования к производителю медицинского изделия	Вопрос: требования к производителю медицинского изделия 	 8 	 Система Медицина
положение о персональных данных	положение о персональных данных 	 2 	 Система Кадры
морское	Вопрос: морское 	 13 	 Система Экология
неустойка-2025: новые подходы в практике по снижению пеней и формулировки для договоров	неустойка-2025: новые подходы в практике по снижению пеней и формулировки для договоров 	 3 	 Система Юрист
как ограничить ответственность за арендуемое помещение	как ограничить ответственность за арендуемое помещение 	 3 	 Система Юрист
услуги брачного агентства	Услуги брачного агентства 	 3 	 Система Юрист
работнику установили нерабочую группу	работнику установили нерабочую группу 	 2 	 Система Кадры
как зарегистрировать автошколу в форме нко	как зарегистрировать автошколу в форме нко 	 3 	 Система Юрист
ответственность при несоблюдении фз сгоз	ответственность при несоблюдении фз сгоз 	 3 	 Система Юрист
пени начисляются до даты погашения долга	пени начисляются до даты погашения долга 	 1 	 Система Бухгалтер
1 января 2025 году работодателям стало проще возместить часть затрат на охрану труда от сфр в рамках финансирования предупредительных мер.	Вопрос: 1 января 2025 году работодателям стало проще возместить часть затрат на охрану труда от сфр в рамках финансирования предупредительных мер. 	 6 	 Система Охрана труда
договоров аренды квартиры	договоров аренды квартиры 	 3 	 Система Юрист
некоммерческое использование	Вопрос: некоммерческое использование 	 3 	 Система Юрист
вступление в силу решения суда при вынесении определения о возвращении апелляционной жалобы	Вопрос: вступление в силу решения суда при вынесении определения о возвращении апелляционной жалобы 	 3 	 Система Юрист
цель обработки персональных данных это	Вопрос: цель обработки персональных данных это 	 2 	 Система Кадры
претензия контрагенту	претензия контрагенту 	 3 	 Система Юрист
абз. 3 ст. 103.10-1 основ законодательства о нотариате	Вопрос: абз. 3 ст. 103.10-1 основ законодательства о нотариате 	 3 	 Система Юрист
когда суд может наложить штраф	Когда суд может наложить штраф 	 3 	 Система Юрист
постановление правительства российской федерации от 21.11.2023 № 1944	постановление правительства российской федерации от 21.11.2023 № 1944 	 5 	 Система Госзаказ
взыскание стоимости бездоговорного потребления в случае если договор с снт растогнут	взыскание стоимости бездоговорного потребления в случае если договор с снт расторгнут 	 3 	 Система Юрист
налоговая оговорка	Налоговая оговорка 	 1 	 Система Бухгалтер
патент гк	Патент гк 	 3 	 Система Юрист
подведомственность статей коап рф	Вопрос: подведомственность статей коап рф 	 3 	 Система Юрист
самозанятость	Вопрос: самозанятость 	 1 	 Система Бухгалтер
отсутствие воды на рабочем месте	Отсутствие воды на рабочем месте 	 6 	 Система Охрана труда
343-фз	Вопрос: 343-фз 	 5 	 Система Госзаказ
арест имущества по ст. 225 упк рф практика	арест имущества по ст. 225 упк рф практика 	 3 	 Система Юрист
кузовной ремонт	Вопрос: кузовной ремонт 	 10 	 Система Управление многоквартирным домом
освоение денежных средств	освоение денежных средств 	 11 	 Система Генеральный директор
гарантийное письмо	гарантийное письмо 	 3 	 Система Юрист
риски стоматолога	Вопрос: риски стоматолога 	 8 	 Система Медицина
приемка в эксплуатацию объекта капитального строительства	Приемка в эксплуатацию объекта капитального строительства 	 14 	 Система Промбезопасность
постановление арбитражного суда московского округа от 11.11.2024 по делу № а41-15746/2022	постановление арбитражного суда московского округа от 11.11.2024 по делу № а41-15746/2022 	 3 	 Система Юрист
законная подсудность по договору между ип	Вопрос: законная подсудность по договору между ип 	 3 	 Система Юрист
395 гк	Вопрос: 395 гк 	 3 	 Система Юрист
рассмотрение жалоб работников на предприятии	Рассмотрение жалоб работников на предприятии 	 2 	 Система Кадры
договор аренды прицепа	договор аренды прицепа 	 3 	 Система Юрист
вл500 кв можно продать	вл500 кв можно продать 	 14 	 Система Промбезопасность
24.02.2009 № 160.	Вопрос: 24.02.2009 № 160 	 3 	 Система Юрист
срок действия отчета об оценки	Система Охрана труда 	 6 	 Система Охрана труда
методика 1118	Методика 1118 	 6 	 Система Охрана труда
какие профстандарты утверждены	какие профстандарты утверждены 	 2 	 Система Кадры
акт приема-передачи договор аренды оборудования	акт приема-передачи договор аренды оборудования 	 3 	 Система Юрист
ходатайство по обеспечению исполнения исполнительного документа	Ходатайство по обеспечению исполнения исполнительного документа 	 3 	 Система Юрист
медосмотр в случае проведения работ на территории обучающего учреждения	медосмотр в случае проведения работ на территории обучающего учреждения 	 8 	 Система Медицина
недопустимость одностороннего изменения договора	недопустимость одностороннего изменения договора 	 3 	 Система Юрист
россия и оаэ	Вопрос: россия и оаэ 	 11 	 Система Генеральный директор
как заказчику отказаться от исполнения договора подряда в одностороннем порядке	как заказчику отказаться от исполнения договора подряда в одностороннем порядке 	 3 	 Система Юрист
распоряжение правительства рф от 20.10.2023 № 2909-р <об утверждении перечня загрязняющих веществ, в отношении которых применяются меры государственного регулирования в области	Вопрос: распоряжение правительства рф от 20.10.2023 № 2909-р <об утверждении перечня загрязняющих веществ, в отношении которых применяются меры государственного регулирования в области 	 13 	 Система Экология
договор о создании (выведении) селекционного достижения	договор о создании (выведении) селекционного достижения 	 3 	 Система Юрист
какие доказательства приложить, чтоб доказать факт владения помещением	какие доказательства приложить, чтоб доказать факт владения помещением 	 3 	 Система Юрист
эмодзи	Вопрос: эмодзи 	 1 	 Система Бухгалтер  
эмодзи	Вопрос: Как оформить прием на работу? 	 2 	 Система Кадры  
эмодзи	Вопрос: Как написать исковое заявление? 	 3 	 Система Юрист  
эмодзи	Вопрос: Как составить бюджет на следующий год? 	 4 	 Система Финансист  
эмодзи	Вопрос: Какие требования по 44-ФЗ? 	 5 	 Система Госзаказ  
эмодзи	Вопрос: Как провести спецоценку условий труда? 	 6 	 Система Охрана труда  
эмодзи	Вопрос: Как подготовить отчет по качеству образования? 	 7 	 Система Образование  
эмодзи	Вопрос: Как организовать дезинфекцию? 	 8 	 Система Медицина  
эмодзи	Вопрос: Как провести мероприятие в библиотеке? 	 9 	 Система Культура  
эмодзи	Вопрос: Как организовать работу ТСЖ? 	 10 	 Система Управление многоквартирным домом  
эмодзи	Вопрос: Как увеличить продажи? 	 12 	 Система Продажи  
эмодзи	Вопрос: Как соблюсти экологические нормы? 	 13 	 Система Экология  
эмодзи	Вопрос: Какие требования по безопасности на производстве? 	 14 	 Система Промбезопасность  
эмодзи	Вопрос: Как отчитываться по налогам в бюджетных учреждениях? 	 15 	 Система Госфинансы  
эмодзи	Вопрос: Как привлечь инвесторов? 	 11 	 Система Генеральный директор
под недружественными лицами понимаются	Вопрос: под недружественными лицами понимаются 	 3 	 Система Юрист
недействительное условие о переходе риска гибели предмета лизинга до момента фактической передачи	недействительное условие о переходе риска гибели предмета лизинга до момента фактической передачи 	 3 	 Система Юрист
машиночитаемой доверенности в формате 003 (emchd_1)	Система Юрист 	 3 	 Система Юрист
618 гк рф	Вопрос: 618 гк рф 	 3 	 Система Юрист
одобрение крупной сделки ооо	одобрение крупной сделки ооо 	 3 	 Система Юрист
