init_query	rep_query	sys_num	sys_name
пункт договора предусматривающий автоматическое продление договора аренды, предполагает обоюдное согласие двух сторон	пункт договора предусматривающий автоматическое продление договора аренды, предполагает обоюдное согласие двух сторон 	 3 	 Система Юрист
судебные прецеденты	судебные прецеденты 	 3 	 Система Юрист
арест средства совершения преступления	арест средства совершения преступления 	 3 	 Система Юрист
плановая проверка	плановая проверка 	 1 	 Система Бухгалтер
разъяснения нотариата	Вопрос: разъяснения нотариата 	 3 	 Система Юрист
санпин 2.1.2.1188-03	санпин 2.1.2.1188-03 	 8 	 Система Медицина
1 ст. 145 нк рф	1 ст. 145 нк рф 	 1 	 Система Бухгалтер
отсутствие сметы к договору строительного подряда	Отсутствие сметы к договору строительного подряда 	 3 	 Система Юрист
постановление госкомстата российской федерации от 11 ноября 1999г, № 100 об утверждении унифицированных форм первичной учетной документации по учету работ в капитальном строительстве и	Вопрос: постановление госкомстата российской федерации от 11 ноября 1999г, № 100 об утверждении унифицированных форм первичной учетной документации по учету работ в капитальном строительстве и 	 15 	 Система Госфинансы
экспертиза апелляция	экспертиза апелляция 	 3 	 Система Юрист
алгоритм действий при смене наименования компании	Вопрос: алгоритм действий при смене наименования компании 	 3 	 Система Юрист
исполнительная документация	исполнительная документация 	 3 	 Система Юрист
соглашение о конфиденциальности	Вопрос: соглашение о конфиденциальности 	 3 	 Система Юрист
гост 27751-2014	Вопрос: гост 27751-2014 	 6 	 Система Охрана труда
можно ли заблочить мобильный телефон, чтобы он работал только с одним оператором	Вопрос: можно ли заблочить мобильный телефон, чтобы он работал только с одним оператором 	 11 	 Система Генеральный директор
устав объединенного института ядерных исследований	Устав объединенного института ядерных исследований 	 3 	 Система Юрист
патент на селекционное достижение	Патент на селекционное достижение 	 3 	 Система Юрист
федеральным законом от 04.05.2011 № 99-фз о лицензировании отдельных видов деятельности	Вопрос: федеральным законом от 04.05.2011 № 99-фз о лицензировании отдельных видов деятельности 	 3 	 Система Юрист
нужно ли согласие каждого сотрудника на размещение персональных данных?	нужно ли согласие каждого сотрудника на размещение персональных данных? 	 2 	 Система Кадры
рассмотрение жалоб работников	Вопрос: рассмотрение жалоб работников 	 2 	 Система Кадры
последний рабочий день полный ?	Вопрос: последний рабочий день полный ? 	 2 	 Система Кадры
крупная сделка	Крупная сделка 	 3 	 Система Юрист
маркировка честный знак	Вопрос: маркировка честный знак 	 1 	 Система Бухгалтер
государственные контракты в форме рамочного или абонентского договора (в.и. татаренко, журнал образование и право, № 2, февраль 2017 г.)	государственные контракты в форме рамочного или абонентского договора (в.и. татаренко, журнал образование и право, № 2, февраль 2017 г.) 	 5 	 Система Госзаказ
возмещение понесенных затрат	Возмещение понесенных затрат 	 4 	 Система Финансист
соут	Соут 	 6 	 Система Охрана труда
должностная инструкция ведущего аналитика рынков отдела маркетинга	должностная инструкция ведущего аналитика рынков отдела маркетинга 	 11 	 Система Генеральный директор
какие требования истец заявляет к соответчику	какие требования истец заявляет к соответчику 	 3 	 Система Юрист
гарантийные обязательства на демонтажные работы	гарантийные обязательства на демонтажные работы 	 3 	 Система Юрист
образец в фас заявления на установление экономически необоснованного тарифа	образец в фас заявления на установление экономически необоснованного тарифа 	 10 	 Система Управление многоквартирным домом
о порядке выдачи допог	о порядке выдачи допог 	 6 	 Система Охрана труда
исковое заявление с привлечением третьего лица	Вопрос: исковое заявление с привлечением третьего лица 	 3 	 Система Юрист
минимальный срок владения имуществом, оплаченным по договору дду,	Минимальный срок владения имуществом, оплаченным по договору ДДУ 	 3 	 Система Юрист
гост р 22.2.14	гост р 22.2.14 	 6 	 Система Охрана труда
шаблон должностной инструкции администратор проекта	шаблон должностной инструкции администратор проекта 	 2 	 Система Кадры
на бумажном носителе	Вопрос: на бумажном носителе 	 1 	 Система Бухгалтер
разьяснение статьи 1 40-фз	Вопрос: разьяснение статьи 1 40-фз 	 5 	 Система Госзаказ
цена иска апк рф	Вопрос: цена иска апк рф 	 3 	 Система Юрист
решение об альтернативном способе принятия решений общего собрания	Вопрос: решение об альтернативном способе принятия решений общего собрания 	 3 	 Система Юрист
ответственность работодателя вахтовый метод вахтовый метод несчастный случай междусменный отдых	ответственность работодателя вахтовый метод вахтовый метод несчастный случай междусменный отдых 	 6 	 Система Охрана труда
определение кс рф от 10 октября 2017 года № 2256-о	Вопрос: определение кс рф от 10 октября 2017 года № 2256-о 	 3 	 Система Юрист
ходатайство о приостановке действия решения государственного органа	ходатайство о приостановке действия решения государственного органа 	 3 	 Система Юрист
оформление протокола общего собрания	оформление протокола общего собрания 	 3 	 Система Юрист
фактическое принятие работ	Вопрос: фактическое принятие работ 	 5 	 Система Госзаказ
продажа лекарственных средтсв	Продажа лекарственных средств 	 8 	 Система Медицина
фз акционерные общества	Вопрос: фз акционерные общества 	 3 	 Система Юрист
договор стоянки транспортных средств	договор стоянки транспортных средств 	 3 	 Система Юрист
лесовосстановление	Вопрос: лесовосстановление 	 13 	 Система Экология
земельный кодекс порядок выхода из снт	земельный кодекс порядок выхода из снт 	 3 	 Система Юрист
1422 от 26.09.2023 депздрав югры	Вопрос: 1422 от 26.09.2023 депздрав югры 	 8 	 Система Медицина
блог	Вопрос: блог 	 11 	 Система Генеральный директор
уведомления об изменении условий труда срок	уведомления об изменении условий труда срок 	 2 	 Система Кадры
какие требования предъявляются к размерам информационных стендов (табло), содержащими схему эвакуации при возникновении чрезвычайная	какие требования предъявляются к размерам информационных стендов (табло), содержащими схему эвакуации при возникновении чрезвычайная 	 6 	 Система Охрана труда
требуется обязательная регистрация права собственности на скважину	Требуется обязательная регистрация права собственности на скважину 	 13 	 Система Экология
договор хранения	договор хранения 	 3 	 Система Юрист
как провести присоединение	как провести присоединение 	 3 	 Система Юрист
средство индивидуальной мобильности	Средство индивидуальной мобильности 	 6 	 Система Охрана труда
постановление правительства рф от 03.12.2014 № 1300	постановление правительства рф от 03.12.2014 № 1300 	 5 	 Система Госзаказ
дополнительное соглашение к договору это	Дополнительное соглашение к договору это 	 3 	 Система Юрист
оплата по дду подтверждает начало владения	оплата по дду подтверждает начало владения 	 10 	 Система Управление многоквартирным домом
комментарии к трудовому кодексу	Комментарий к трудовому кодексу 	 2 	 Система Кадры
приемка товара рекомендация покупатель	Вопрос: приемка товара рекомендация покупатель 	 5 	 Система Госзаказ
отношения с самозанятыми	Отношения с самозанятыми 	 3 	 Система Юрист
юридический адрес в нескольких помещениях	юридический адрес в нескольких помещениях 	 3 	 Система Юрист
приказ № 309 от 19.07.2024 статистика	Приказ № 309 от 19.07.2024 статистика 	 7 	 Система Образование
калькулятор онлайн	Вопрос: калькулятор онлайн 	 4 	 Система Финансист
годовое собрание участников 2025	годовое собрание участников 2025 	 3 	 Система Юрист
как отстранить медика не прошедшего аккредитацию	как отстранить медика не прошедшего аккредитацию 	 8 	 Система Медицина
ходатайство о приостановлении производства по делу по гпк рф	ходатайство о приостановлении производства по делу по гпк рф 	 3 	 Система Юрист
уступка по договорам займа налоги для цедента и цессионария	уступка по договорам займа налоги для цедента и цессионария 	 3 	 Система Юрист
совет директоров ао	Вопрос: совет директоров ао 	 3 	 Система Юрист
документированная процедура архив	Вопрос: документированная процедура архив 	 7 	 Система Образование
постановлением правительством москвы от 26.08.2020 № 1386-пп	постановлением правительством москвы от 26.08.2020 № 1386-пп 	 5 	 Система Госзаказ
вестник экономического правосудия	вестник экономического правосудия 	 3 	 Система Юрист
фос ежегодная индексация	Вопрос: фос ежегодная индексация 	 4 	 Система Финансист
форма приказа	Вопрос: форма приказа 	 2 	 Система Кадры
банкротство физических лиц упрощенный порядок	банкротство физических лиц упрощенный порядок 	 3 	 Система Юрист
ст. 12 гпк	Вопрос: ст. 12 гпк 	 3 	 Система Юрист
как провести собрание сд по вопросу	Вопрос: как провести собрание сд по вопросу 	 11 	 Система Генеральный директор
договор о поручении она обработку персональных данных	Договор о поручении на обработку персональных данных 	 3 	 Система Юрист
возражения исключение из егрюл	Возражения исключение из ЕГРЮЛ 	 3 	 Система Юрист
наряд накладная	Вопрос: наряд накладная 	 1 	 Система Бухгалтер
росатом требования к поставщикам кии	росатом требования к поставщикам кии 	 5 	 Система Госзаказ
восстановление ученой степени	Вопрос: восстановление ученой степени 	 7 	 Система Образование
приказ о снятии дисциплинарного взыскания	Приказ о снятии дисциплинарного взыскания 	 2 	 Система Кадры
фз об ооо изменения	фз об ооо изменения 	 3 	 Система Юрист
налог на добычу недр воды	налог на добычу недр воды 	 13 	 Система Экология
акт о простое транспортного средства	акт о простое транспортного средства 	 4 	 Система Финансист
как утвердить положение о нормировании	как утвердить положение о нормировании 	 6 	 Система Охрана труда
возврат переплаты по исполнительному листу	возврат переплаты по исполнительному листу 	 3 	 Система Юрист
первая группа инвалидности	Вопрос: первая группа инвалидности 	 3 	 Система Юрист
33-2773/2022	Вопрос: 33-2773/2022 	 3 	 Система Юрист
постановление правительства № 413	Вопрос: постановление правительства № 413 	 5 	 Система Госзаказ
19.5 п. 23 коап судебная практика	Вопрос: 19.5 п. 23 коап судебная практика 	 Номер системы: 3 	 Название системы: Система Юрист
доверенность на юридическое лицо передоверие	доверенность на юридическое лицо передоверие 	 3 	 Система Юрист
незаконное отключение газа	незаконное отключение газа 	 10 	 Система Управление многоквартирным домом
что требуется для продажи защиты вл 500кв	Вопрос: что требуется для продажи защиты вл 500кв 	 12 	 Система Продажи
не предоставление протокола общего собрания в ресурсоснабжающую организацию	не предоставление протокола общего собрания в ресурсоснабжающую организацию 	 10 	 Система Управление многоквартирным домом
договор оказания услуг спецтехники с ип	договор оказания услуг спецтехники с ип 	 3 	 Система Юрист
тр тс 032	тс 032 	 6 	 Система Охрана труда
что проверить в договоре займа	что проверить в договоре займа 	 3 	 Система Юрист
постановление конституционного суда рф от 13.02.2018 № 8-п	Вопрос: постановление конституционного суда рф от 13.02.2018 № 8-п 	 3 	 Система Юрист
нужно ли уведомлять за два месяца работников о новых результатах соут	нужно ли уведомлять за два месяца работников о новых результатах соут 	 6 	 Система Охрана труда
образец служебной записки о покупке дополнительного офиса	Вопрос: образец служебной записки о покупке дополнительного офиса 	 11 	 Система Генеральный директор
не соответствует требованиям указанным в смгс убытки	не соответствует требованиям указанным в смгс убытки 	 14 	 Система Промбезопасность
изменение цены	Изменение цены 	 12 	 Система Продажи
иск о разделе имущества	иск о разделе имущества 	 3 	 Система Юрист
в состав общего имущества не включаются сети связи, необходимые для оказания услуг связи собственникам помещений в многоквартирном доме или нанимателям жилых помещений в многоквартирном доме по	Вопрос: в состав общего имущества не включаются сети связи, необходимые для оказания услуг связи собственникам помещений в многоквартирном доме или нанимателям жилых помещений в многоквартирном доме по 	 10 	 Система Управление многоквартирным домом
электронная почта доказательство	Вопрос: электронная почта доказательство 	 3 	 Система Юрист
уведомление о завершении грузовой операции	Вопрос: уведомление о завершении грузовой операции 	 4 	 Система Финансист
образцы договоров аренды на разные случаи	образцы договоров аренды на разные случаи 	 3 	 Система Юрист
акт приема-передачи товара на экспертизу	акт приема-передачи товара на экспертизу 	 3 	 Система Юрист
инн 2015009810	инн 2015009810 	 1 	 Система Бухгалтер
имущество в залоге осталось в арендуемом помещении	имущество в залоге осталось в арендуемом помещении 	 3 	 Система Юрист
что такое возврат имущество по договору аренды	Вопрос: что такое возврат имущества по договору аренды 	 3 	 Система Юрист
как расторгнуть договор по п. 3 ст. 715 гк рф	как расторгнуть договор по п. 3 ст. 715 гк рф 	 3 	 Система Юрист
алгоритм действий при смене наименования ао	Вопрос: алгоритм действий при смене наименования ао 	 3 	 Система Юрист
пункту 2 статьи 213.3	Вопрос: пункту 2 статьи 213.3 	 3 	 Система Юрист
сроки выставления акта	Система Юрист 	 3 	 Система Юрист
апелляционная жалоба на определение арбитражного суда о возвращении искового заявления	апелляционная жалоба на определение арбитражного суда о возвращении искового заявления 	 3 	 Система Юрист
дистанционное увольнение	дистанционное увольнение 	 2 	 Система Кадры
возражение использование товарного знака	возражение использование товарного знака 	 3 	 Система Юрист
инструкция по передаче сведений в ерир	Вопрос: инструкция по передаче сведений в ерир 	 5 	 Система Госзаказ
аастренд	Вопрос: аастренд 	 11 	 Система Генеральный директор
ст. 30 ук рф	Вопрос: ст. 30 ук рф 	 3 	 Система Юрист
ст. 10 фз от 25.12.2008 № 273-фз.	Вопрос: ст. 10 фз от 25.12.2008 № 273-фз 	 7 	 Система Образование
98/93623359	Вопрос: 98/93623359 	 11 	 Система Генеральный директор
вправе ли работник отказаться подписывать договор о полной материальной ответственности	вправе ли работник отказаться подписывать договор о полной материальной ответственности 	 2 	 Система Кадры
дополнительное соглашение к трудовому договору с дизайнером	Дополнительное соглашение к трудовому договору с дизайнером 	 2 	 Система Кадры
для кого обязательный медосмотр при устройстве на работу	для кого обязательный медосмотр при устройстве на работу 	 8 	 Система Медицина
