init_query	rep_query	sys_num	sys_name
п. 1 ст. 784 п. 2 ст 785ф	Вопрос: п. 1 ст. 784 п. 2 ст 785ф 	 3 	 Система Юрист
нарушение подрядчиком от и тб	нарушение подрядчиком от и тб 	 3 	 Система Юрист
смена ифнс	Смена ифнс 	 1 	 Система Бухгалтер
признать предварительный договор купли-продажи состоявшимся	признать предварительный договор купли-продажи состоявшимся 	 3 	 Система Юрист
удержание из обеспечительного платежа по договору аренды	Удержание из обеспечительного платежа по договору аренды 	 3 	 Система Юрист
расторжение договора на оказание платных образовательных услуг	расторжение договора на оказание платных образовательных услуг 	 7 	 Система Образование
арест имущества по ст. 115 упк рф практика	Вопрос: арест имущества по ст. 115 упк рф практика 	 3 	 Система Юрист
расслоение топлива летнего	Вопрос: расслоение топлива летнего 	 14 	 Система Промбезопасность
использование в некоммерческих целях	Вопрос: использование в некоммерческих целях 	 11 	 Система Генеральный директор
приемка по го	приемка по го 	 6 	 Система Охрана труда
если работник отказывается от ознакомления должностной инструкцией	если работник отказывается от ознакомления должностной инструкцией 	 2 	 Система Кадры
судебные решения по застройщикам	судебные решения по застройщикам 	 3 	 Система Юрист
апелляция передаче по подсудности	апелляция передаче по подсудности 	 3 	 Система Юрист
обоснование арендной платы	Обоснование арендной платы 	 3 	 Система Юрист
- постановление правительства российской федерации от 30 октября 2014 года № 1130	Постановление правительства российской федерации от 30 октября 2014 года № 1130 	 5 	 Система Госзаказ
акт оперативной	акт оперативной 	 3 	 Система Юрист
отгрузка	отгрузка 	 2 	 Система Кадры
определение вс рф от 19.04.2021 № 307-эс20-17293	Определение ВС РФ от 19.04.2021 № 307-ЭС20-17293 	 3 	 Система Юрист
договор поставки с республикой беларусь	договор поставки с республикой беларусь 	 3 	 Система Юрист
расходы на транспортные услуги если нет транспортной накладной но есть детализация	Расходы на транспортные услуги если нет транспортной накладной но есть детализация 	 1 	 Система Бухгалтер
пьяный на работе ние при состоянии алкогольного опьянения	пьяный на работе ние при состоянии алкогольного опьянения 	 6 	 Система Охрана труда
как изменить адрес электронной почты в егрюл	как изменить адрес электронной почты в егрюл 	 3 	 Система Юрист
решение об одобрении крупной сделки	Вопрос: решение об одобрении крупной сделки 	 3 	 Система Юрист
п. 1 ст. 20.1 федерального закона от 24.07.1998 № 125-фз	Вопрос: п. 1 ст. 20.1 федерального закона от 24.07.1998 № 125-фз 	 3 	 Система Юрист
уступка прав по договору займа между недружественного резидента 95 указ	Уступка прав по договору займа между недружественного резидента 95 указ 	 3 	 Система Юрист
как отстранить от работы медика, который не прошел аккредитацию	как отстранить от работы медика, который не прошел аккредитацию 	 8 	 Система Медицина
лимит отсрочки оплаты	лимит отсрочки оплаты 	 4 	 Система Финансист
китай	Вопрос: китай 	 3 	 Система Юрист
условия договора порядок исполнения	Условия договора порядок исполнения 	 3 	 Система Юрист
ст. 40 закона № 248-фз	Вопрос: ст. 40 закона № 248-фз 	 3 	 Система Юрист
годовое собрание ооо 2025	Вопрос: годовое собрание ооо 2025 	 3 	 Система Юрист
решение о согласии на совершение или о последующем одобрении крупной сделки, если требование о наличии такого решения установлен	Вопрос: решение о согласии на совершение или о последующем одобрении крупной сделки, если требование о наличии такого решения установлен 	 3 	 Система Юрист
ответ на претензию о персональных данных	ответ на претензию о персональных данных 	 3 	 Система Юрист
передача визиток третьих лиц с фото с перс данными	Вопрос: передача визиток третьих лиц с фото с перс данными 	 3 	 Система Юрист
протокол собрания участников несогласие с передачей доли наследнику долю обществу	протокол собрания участников несогласие с передачей доли наследнику долю обществу 	 3 	 Система Юрист
можно ли продавать товарные образцы?	можно ли продавать товарные образцы? 	 12 	 Система Продажи
лимит задолженности по оплате	лимит задолженности по оплате 	 4 	 Система Финансист
взыскать с причинителя вреда страховая не исполнила обязательства прямое возмещение	Вопрос: взыскать с причинителя вреда страховая не исполнила обязательства прямое возмещение 	 3 	 Система Юрист
медицинский осмотр не является обязательным	Вопрос: медицинский осмотр не является обязательным 	 8 	 Система Медицина
ндфл продажа квартиры	ндфл продажа квартиры 	 1 	 Система Бухгалтер
вправе ли проживать по ордеру без прописки	вправе ли проживать по ордеру без прописки 	 10 	 Система Управление многоквартирным домом
права арендатора на арендуемое помещение	права арендатора на арендуемое помещение 	 3 	 Система Юрист
распоряжение оао ржд № 1841/р от 31.07.2024	Вопрос: распоряжение оао ржд № 1841/р от 31.07.2024 	 3 	 Система Юрист
1235 гк	Вопрос: 1235 гк 	 3 	 Система Юрист
условия инкотремся	Вопрос: условия инкотремся 	 3 	 Система Юрист
разрешительный режим	Разрешительный режим 	 6 	 Система Охрана труда
гост 5264-80	Вопрос: гост 5264-80 	 10 	 Система Управление многоквартирным домом
срок исполнительной давности	Вопрос: срок исполнительной давности 	 3 	 Система Юрист
постановлением правительства рф от 31.12.2021 № 2606	постановлением правительства рф от 31.12.2021 № 2606 	 5 	 Система Госзаказ
документы при заселении в гостиницу	Вопрос: документы при заселении в гостиницу 	 8 	 Система Медицина
судебная практика персональные данные	судебная практика персональные данные 	 3 	 Система Юрист
после утверждения соут, какой срок уведомление	Вопрос: после утверждения соут, какой срок уведомление 	 6 	 Система Охрана труда
положение о дисциплинарной ответственности	Вопрос: положение о дисциплинарной ответственности 	 3 	 Система Юрист
сп 115.133330.2016	Вопрос: сп 115.133330.2016 	 6 	 Система Охрана труда
договор займа проценты с	договор займа проценты с 	 3 	 Система Юрист
дата предоставления протокола общего собрания собственников в ресурсоснабжающую организацию по заключению прямых договоров	Дата предоставления протокола общего собрания собственников в ресурсоснабжающую организацию по заключению прямых договоров 	 10 	 Система Управление многоквартирным домом
обязательство о добровольном возмещении ущерба	обязательство о добровольном возмещении ущерба 	 3 	 Система Юрист
п. 6.2 ст 210 нк	п. 6.2 ст 210 нк 	 1 	 Система Бухгалтер
подпунктом 1 п. 4 ст. 374 налогового кодекса рф	Вопрос: подпунктом 1 п. 4 ст. 374 налогового кодекса рф 	 1 	 Система Бухгалтер
отчет в ерир	Отчет в ерир 	 1 	 Система Бухгалтер
25794.1	Вопрос: 25794.1 	 1 	 Система Бухгалтер
условие о коммерческом кредите	Условие о коммерческом кредите 	 4 	 Система Финансист
письмо минтруда от 26.03.2020 № 15-1/в-1375	письмо минтруда от 26.03.2020 № 15-1/в-1375 	 2 	 Система Кадры
когда подписывается приемо-сдаточный акт отходов металла	Когда подписывается приемо-сдаточный акт отходов металла 	 14 	 Система Промбезопасность
доверенность в порядке передоверия	Вопрос: доверенность в порядке передоверия 	 3 	 Система Юрист
передача прав и обязанностей по договору аренды земельного участка	передача прав и обязанностей по договору аренды земельного участка 	 3 	 Система Юрист
постановление № 1229 от 10.09.2024	постановление № 1229 от 10.09.2024 	 3 	 Система Юрист
обращение в фас о неисполнении предписания	обращение в фас о неисполнении предписания 	 3 	 Система Юрист
молодой специалист	Вопрос: молодой специалист 	 2 	 Система Кадры
как зарегистрировать ноу дпо автошкола	как зарегистрировать ноу дпо автошкола 	 3 	 Система Юрист
фас рф в решении от 29.04.2022 № 11/43961-дсп/22 по делу 11/01/10-34/2021	Вопрос: фас рф в решении от 29.04.2022 № 11/43961-дсп/22 по делу 11/01/10-34/2021 	 5 	 Система Госзаказ
приказ тпп № 52	Приказ тпп № 52 	 3 	 Система Юрист
размер пошлины при подаче заявления о включении в реестр требований кредиторов	Размер пошлины при подаче заявления о включении в реестр требований кредиторов 	 3 	 Система Юрист
особо охраняемых природных территориях федерального значения	Вопрос: особо охраняемых природных территориях федерального значения 	 13 	 Система Экология
журнал движения трудовых книжек как вести	Журнал движения трудовых книжек как вести 	 2 	 Система Кадры
закон иркутской области 83-оз от 24.10.2024	Вопрос: закон иркутской области 83-оз от 24.10.2024 	 3 	 Система Юрист
добрый день. нужно ли сотрудникам компании в случае их организации мероприятия в виде олимпиады на территории учебного заведения проходить медосмотр и оформлять медицинские книжки?	Вопрос: добрый день. нужно ли сотрудникам компании в случае их организации мероприятия в виде олимпиады на территории учебного заведения проходить медосмотр и оформлять медицинские книжки? 	 8 	 Система Медицина
финансирование по охране труда на 2025	финансирование по охране труда на 2025 	 6 	 Система Охрана труда
письмо в банк о продлении банковской гарантии	письмо в банк о продлении банковской гарантии 	 4 	 Система Финансист
закон об акционерных обществах	закон об акционерных обществах 	 3 	 Система Юрист
гк рф договор поставки	гк рф договор поставки 	 3 	 Система Юрист
понуждение об индексации заработной платы	понуждение об индексации заработной платы 	 2 	 Система Кадры
сколько действует договор если не указан срок	Вопрос: сколько действует договор если не указан срок 	 3 	 Система Юрист
врач ип на работе в медицинской организации	врач ип на работе в медицинской организации 	 8 	 Система Медицина
пример доверенности от организации в порядке передоверия при основной доверенности на организацию	Вопрос: пример доверенности от организации в порядке передоверия при основной доверенности на организацию 	 3 	 Система Юрист
без права застройки	Без права застройки 	 10 	 Система Управление многоквартирным домом
антикоррупционной регламент образец	антикоррупционной регламент образец 	 3 	 Система Юрист
можно ли выплатить заработную плату при аресте счета судом	можно ли выплатить заработную плату при аресте счета судом 	 3 	 Система Юрист
постановление № 37/23	Вопрос: постановление № 37/23 	 3 	 Система Юрист
сальдо встречных обязательств лизинг гибель предмета лизинга	сальдо встречных обязательств лизинг гибель предмета лизинга 	 4 	 Система Финансист
уведомление военкомата о приеме	уведомление военкомата о приеме 	 2 	 Система Кадры
обязанности работодателя по соблюдению воинского учета	обязанности работодателя по соблюдению воинского учета 	 2 	 Система Кадры
ответственность гоз	Ответственность гоз 	 3 	 Система Юрист
начисления за электроэнергию если поломан общедомовой прибор учета по свету	Начисления за электроэнергию если поломан общедомовой прибор учета по свету 	 10 	 Система Управление многоквартирным домом
управление проектами	Управление проектами 	 4 	 Система Финансист
как проверить юр адрес	как проверить юр адрес 	 3 	 Система Юрист
нестандартные обычаи делового оборота	Вопрос: нестандартные обычаи делового оборота 	 3 	 Система Юрист
силовые машины	Вопрос: силовые машины 	 14 	 Система Промбезопасность
полная материальная ответственность	полная материальная ответственность 	 2 	 Система Кадры
инн 0202009246	инн 0202009246 	 1 	 Система Бухгалтер
ведение трудовой книжки передано в оцо	Вопрос: ведение трудовой книжки передано в оцо 	 2 	 Система Кадры
ак прописать условие об обработке персональных данных в договоре	Вопрос: ак прописать условие об обработке персональных данных в договоре 	 3 	 Система Юрист
соглашение о намерениях	Система Юрист 	 3 	 Система Юрист
учреждение оо	учреждение оо 	 15 	 Система Госфинансы
применение усн основание	Применение усн основание 	 1 	 Система Бухгалтер
обязанность застройщика строить социальные объекты	Обязанность застройщика строить социальные объекты 	 10 	 Система Управление многоквартирным домом
в связи с применением исполнителем освобождения от исполнения обязанностей налогоплательщика ндс не уплачивается.	Вопрос: в связи с применением исполнителем освобождения от исполнения обязанностей налогоплательщика ндс не уплачивается. 	 1 	 Система Бухгалтер
федеральный конституционный закон рф о чрезвычайном положении от 30.05.2001	Вопрос: федеральный конституционный закон рф о чрезвычайном положении от 30.05.2001 	 3 	 Система Юрист
условие о валютном коридоре	Вопрос: условие о валютном коридоре 	 4 	 Система Финансист
пп 291 от 16.04.2012	пп 291 от 16.04.2012 	 1 	 Система Бухгалтер
цифровой товар подписка	Вопрос: цифровой товар подписка 	 11 	 Система Генеральный директор
должностная инструкция руководителя отдела разработок	должностная инструкция руководителя отдела разработок 	 11 	 Система Генеральный директор
оплата сверхурочных за работу в праздничный день сменному персоналу	оплата сверхурочных за работу в праздничный день сменному персоналу 	 2 	 Система Кадры
срок поставки товара привязан к нескольким событиям	Система Госзаказ 	 5 	 Система Госзаказ
учет инструментов на предприятии	Вопрос: учет инструментов на предприятии 	 4 	 Система Финансист
кадровый аутсорс	Кадровый аутсорс 	 2 	 Система Кадры
взыскание убытков по договору поручения	взыскание убытков по договору поручения 	 3 	 Система Юрист
договорная работа	договорная работа 	 3 	 Система Юрист
прогнозный план (программу) приватизации федерального имущества на 2024-2026 годы	Вопрос: прогнозный план (программу) приватизации федерального имущества на 2024-2026 годы 	 11 	 Система Генеральный директор
ростех приказ № 150	Вопрос: ростех приказ № 150 	 3 	 Система Юрист
пошлины за поддержание патента в силе	пошлины за поддержание патента в силе 	 3 	 Система Юрист
федеральный закон № 63-фз об электронной подписи	федеральный закон № 63-фз об электронной подписи 	 3 	 Система Юрист
годовое собрание 2025	Вопрос: годовое собрание 2025 	 11 	 Система Генеральный директор
ответственность рекламораспространителя	Вопрос: ответственность рекламораспространителя 	 3 	 Система Юрист
ст. 14 кас	Вопрос: ст. 14 кас 	 1 	 Система Бухгалтер
сп 267.1325800.2016	Вопрос: сп 267.1325800.2016 	 8 	 Система Медицина
может ли специалист поступить в магитсратуру	Вопрос: может ли специалист поступить в магитсратуру 	 7 	 Система Образование
условие поставки в спецификации	Вопрос: условие поставки в спецификации 	 5 	 Система Госзаказ
эпатажный маркетинг. как госорганы борются с неэтичностью в брендировании на примере сети японских ресторанов показали, как складывается практика в спорах о неэтичности брендов - в рекламе, товарных	Вопрос: эпатажный маркетинг. как госорганы борются с неэтичностью в брендировании на примере сети японских ресторанов показали, как складывается практика в спорах о неэтичности брендов - в рекламе, товарных 	 11 	 Система Генеральный директор
